{
  "$schema": "http://json-schema.org/draft-07/schema#",
  "title": "CharacterPreset v1",
  "type": "object",
  "required": ["schema_version", "id", "health", "movement", "collider", "stamina", "combat"],
  "additionalProperties": false,
  "properties": {
    "schema_version": { "const": 1 },
    "id": { "type": "string", "pattern": "^[a-z][a-z0-9_]*$" },
    "health": {
      "type": "object",
      "required": ["maxHealth", "armor", "resistance"],
      "additionalProperties": false,
      "properties": {
        "maxHealth":  { "type": "number", "exclusiveMinimum": 0 },
        "armor":      { "type": "number", "minimum": 0 },
        "resistance": { "type": "number", "minimum": 0, "maximum": 1 }
      }
    },
    "movement": {
      "type": "object",
      "required": [
        "movementSpeed", "rotationSpeed", "sprintMultiplier", "crouchMultiplier",
        "jumpVelocity", "dodgeVelocity", "airControlFactor", "acceleration",
        "deceleration", "mass", "friction", "drag", "maxSpeed", "maxFallSpeed"
      ],
      "additionalProperties": false,
      "properties": {
        "movementSpeed":    { "type": "number", "exclusiveMinimum": 0 },
        "rotationSpeed":    { "type": "number", "exclusiveMinimum": 0 },
        "sprintMultiplier": { "type": "number", "exclusiveMinimum": 0 },
        "crouchMultiplier": { "type": "number", "exclusiveMinimum": 0 },
        "jumpVelocity":     { "type": "number", "minimum": 0 },
        "dodgeVelocity":    { "type": "number", "minimum": 0 },
        "airControlFactor": { "type": "number", "minimum": 0, "maximum": 1 },
        "acceleration":     { "type": "number", "exclusiveMinimum": 0 },
        "deceleration":     { "type": "number", "exclusiveMinimum": 0 },
        "mass":             { "type": "number", "exclusiveMinimum": 0 },
        "friction":         { "type": "number", "minimum": 0, "maximum": 1 },
        "drag":             { "type": "number", "minimum": 0 },
        "maxSpeed":         { "type": "number", "exclusiveMinimum": 0 },
        "maxFallSpeed":     { "type": "number", "exclusiveMinimum": 0 }
      }
    },
    "collider": {
      "type": "object",
      "required": ["radius", "height"],
      "additionalProperties": false,
      "properties": {
        "radius": { "type": "number", "exclusiveMinimum": 0 },
        "height": { "type": "number", "exclusiveMinimum": 0 }
      }
    },
    "stamina": {
      "type": "object",
      "required": ["maxStamina", "baseRegenRate", "drainDelaySeconds", "sprintCostPerSec", "jumpCost"],
      "additionalProperties": false,
      "properties": {
        "maxStamina":         { "type": "number", "exclusiveMinimum": 0 },
        "baseRegenRate":      { "type": "number", "minimum": 0 },
        "drainDelaySeconds":  { "type": "number", "minimum": 0 },
        "sprintCostPerSec":   { "type": "number", "minimum": 0 },
        "jumpCost":           { "type": "number", "minimum": 0 }
      }
    },
    "combat": {
      "type": "object",
      "required": ["baseDamage", "damageMultiplier", "criticalChance", "criticalMultiplier", "attackChain", "skill1", "skill2"],
      "additionalProperties": false,
      "properties": {
        "baseDamage":         { "type": "number", "minimum": 0 },
        "damageMultiplier":   { "type": "number", "exclusiveMinimum": 0 },
        "criticalChance":     { "type": "number", "minimum": 0, "maximum": 1 },
        "criticalMultiplier": { "type": "number", "minimum": 1 },
        "attackChain": {
          "type": "array",
          "minItems": 1,
          "maxItems": 8,
          "items": { "$ref": "#/definitions/attackStage" }
        },
        "skill1": { "$ref": "#/definitions/skill" },
        "skill2": { "$ref": "#/definitions/skill" }
      }
    }
  },
  "definitions": {
    "attackStage": {
      "type": "object",
      "required": ["damageMultiplier", "range", "duration", "movementMultiplier", "chainWindow", "staminaCost"],
      "additionalProperties": false,
      "properties": {
        "damageMultiplier":   { "type": "number", "exclusiveMinimum": 0 },
        "range":              { "type": "number", "exclusiveMinimum": 0 },
        "duration":           { "type": "number", "exclusiveMinimum": 0 },
        "movementMultiplier": { "type": "number", "minimum": 0, "maximum": 1 },
        "chainWindow":        { "type": "number", "minimum": 0 },
        "attackAngle":        { "type": "number", "default": 0.7, "exclusiveMinimum": 0 },
        "staminaCost":        { "type": "number", "minimum": 0 }
      }
    },
    "skill": {
      "type": "object",
      "required": ["params"],
      "additionalProperties": false,
      "properties": {
        "params":       { "$ref": "#/definitions/skillParams" },
        "cooldown":     { "type": "number", "default": 0.0, "minimum": 0 },
        "castDuration": { "type": "number", "default": 0.0, "minimum": 0 },
        "staminaCost":  { "type": "number", "default": 0.0, "minimum": 0 }
      }
    },
    "skillParams": {
      "oneOf": [
        {
          "type": "object",
          "required": ["type", "range", "movementMultiplier", "dmgMultiplier"],
          "additionalProperties": false,
          "properties": {
            "type":               { "const": "melee_aoe" },
            "range":              { "type": "number", "exclusiveMinimum": 0 },
            "movementMultiplier": { "type": "number", "minimum": 0, "maximum": 1 },
            "dmgMultiplier":      { "type": "number", "exclusiveMinimum": 0 }
          }
        }
      ]
    }
  }
}
